{
  "sys_id": "500123",
  "name": "Example Title",
  "short_description": "example_value",
  "description": "A sample description.",
  "category": "example_value",
  "price": "example_value",
  "picture": "example_value",
  "mandatory_attachment": true,
  "request_method": "example_value",
  "variables": []
}